{
  "schemaVersion": 1,
  "manifestType": "world-builder-current-project-capability",
  "projectId": "11111111-1111-4111-8111-111111111111",
  "projectSchemaId": "world-builder-project-v2",
  "projectSchemaHash": "aaaaaaaaaaaaaaaaaaaaaaaaaaaaaaaaaaaaaaaaaaaaaaaaaaaaaaaaaaaaaaaa",
  "authoredDataFingerprintSha256": "bbbbbbbbbbbbbbbbbbbbbbbbbbbbbbbbbbbbbbbbbbbbbbbbbbbbbbbbbbbbbbbb",
  "allowedVariantIds": ["current-base-v1"],
  "requiredCapabilityIds": ["canonical-signed-layered-map-v1"],
  "requiredModuleIds": [],
  "capabilityFingerprintSha256": "f8f938daf0e1ffd7c9530d8e998700f1d54cc23e995074025558a6dcdd5f5a75"
}
